{
  "id": "linear",
  "schema_version": "0.3",
  "url": "https://linear.app",
  "title": "Linear",
  "image": "https://image.thum.io/get/width/1440/https://linear.app",
  "tags": [
    "SaaS",
    "Productivity",
    "App UI",
    "Dark Mode"
  ],
  "status": "vision_done",
  "added_at": "2026-05-28",
  "added_by": "curator",
  "_meta": {
    "vision_model": "mimo-v2.5",
    "vision_prompt_version": "0.2_legacy",
    "vision_at": "2026-05-28T02:34:53.138Z"
  },
  "spec": {
    "colors": {
      "bg": null,
      "bgSoft": null,
      "bgQuiet": null,
      "ink": null,
      "inkSoft": null,
      "muted": null,
      "mutedSoft": null,
      "accent": null,
      "line": null
    },
    "typography": {
      "display": "geometric-sans",
      "body": "geometric-sans",
      "mono": null,
      "scale": [
        {
          "token": "display",
          "size": 56,
          "lh": 1.1,
          "weight": 500,
          "ls": "-1px"
        },
        {
          "token": "h1",
          "size": 48,
          "lh": 1.2,
          "weight": 500,
          "ls": "0"
        },
        {
          "token": "body",
          "size": 16,
          "lh": 1.5,
          "weight": 400,
          "ls": "0"
        },
        {
          "token": "caption",
          "size": 12,
          "lh": 1.4,
          "weight": 500,
          "ls": "0.06em"
        }
      ]
    },
    "spacing": {
      "base": 8,
      "scale": [
        4,
        8,
        16,
        24,
        32,
        48,
        64,
        96
      ]
    },
    "surfaces": {
      "radius": {
        "sm": 0,
        "md": 0,
        "lg": 0,
        "pill": 999
      }
    },
    "layout": {
      "container": 1200,
      "paragraph": 640,
      "columns": 1,
      "gutter": 24,
      "breakpoints": [
        768,
        1024,
        1200
      ]
    },
    "motion": {
      "durations": {
        "micro": null,
        "small": null,
        "medium": null
      },
      "easing": null
    }
  },
  "desc": {
    "en": {
      "palette": "Deep-space background with high-contrast white type; restrained violet-blue signal color; hover reveals a gradient glow.",
      "layout": "Hero is a real product UI screenshot; sections below break by feature module — tight pacing, no marketing fluff.",
      "interaction": "Subtle gradient sweep on hover; feature cards lift in a 3D parallax that adds depth.",
      "motion": "Mostly 200–400ms ease-out; the glow animation uses longer easing for a premium feel.",
      "notes": "The ceiling for project-management tool design — what every SaaS product secretly wants to copy."
    },
    "zh-CN": {
      "palette": "深空底配高对比白文字，紫蓝信号色克制点缀，hover 出渐变光晕",
      "layout": "首屏直接放真实产品 UI 截图，下方按功能模块分区，每个 section 节奏紧凑无冗余 marketing copy",
      "interaction": "Hover 上有微妙渐变扫光，feature 卡片用 3D parallax 增加层次",
      "motion": "200-400ms ease-out 为主，光晕动画用更长的缓动制造高级感",
      "notes": "项目管理工具里设计天花板，几乎是每个 SaaS 产品想抄的目标"
    },
    "zh-TW": {
      "palette": "深空底搭高對比白文字,紫藍信號色克制點綴,hover 出漸變光暈",
      "layout": "首屏直接放真實產品 UI 截圖,下方按功能模組分區,每個 section 節奏緊湊無冗餘 marketing copy",
      "interaction": "Hover 上有微妙漸變掃光,feature 卡片用 3D parallax 增加層次",
      "motion": "200-400ms ease-out 為主,光暈動畫用更長的緩動製造高級感",
      "notes": "專案管理工具裡設計天花板,幾乎是每個 SaaS 產品想抄的目標"
    },
    "ja": {
      "palette": "ディープスペースの背景に高コントラストの白文字、抑えた紫青のシグナルカラー、hover で出るグラデーションの光暈。",
      "layout": "ヒーローは実プロダクト UI のスクショ。下は機能モジュールごとに区切り、各 section はマーケコピーなしでタイトに進む。",
      "interaction": "Hover で微妙なグラデーションのスイープ、フィーチャーカードに 3D パララックスで奥行き。",
      "motion": "200–400ms の ease-out が基本、光暈アニメだけは長めの easing で高級感を作る。",
      "notes": "プロジェクト管理ツールの設計天井 — どの SaaS も内心では真似したい標準。"
    },
    "ko": {
      "palette": "딥 스페이스 배경에 고대비 화이트 텍스트, 절제된 보라-파랑 시그널 컬러, hover 시 그라데이션 광휘.",
      "layout": "히어로는 실제 제품 UI 스크린샷, 아래는 기능 모듈별 구획 — 각 section 타이트하고 마케팅 군더더기 없음.",
      "interaction": "Hover 시 미묘한 그라데이션 스윕, 기능 카드는 3D 파랄럭스로 깊이감.",
      "motion": "기본 200–400ms ease-out, 광휘 애니메이션만 더 긴 easing 으로 고급감.",
      "notes": "프로젝트 관리 도구 디자인의 천장 — 모든 SaaS 가 속으로 따라하고 싶어하는 기준."
    }
  },
  "spec_i18n": {
    "en": {
      "identity": {
        "keywords": [
          "深色模式",
          "克制留白",
          "几何字体",
          "功能优先",
          "水平导航"
        ],
        "analogy": "是安静的、只有键盘敲击声的深夜实验室，不是科技公司的未来感办公室",
        "oneLiner": "为专业团队打造的、极度克制的工具感界面"
      },
      "colors": {
        "principle": "深色模式下的极简单色配色，依赖白色文字与深色背景形成强对比"
      },
      "typography": {
        "rules": [
          "标题使用 500 weight，不使用粗体",
          "导航文字全大写，字间距加大",
          "caption 使用小号、中等字重、加大字间距"
        ],
        "scaleUses": [
          "首屏主标题",
          "区块标题",
          "正文内容",
          "导航栏链接文字"
        ]
      },
      "spacing": {
        "rhythm": "慷慨的留白，内容呼吸感强"
      },
      "surfaces": {
        "shadows": [
          "无阴影，依赖平面与边线区分层级"
        ],
        "borders": "极细的白色线条用于分割导航元素"
      },
      "layout": {
        "skeleton": "顶部固定导航栏 → 巨大的左对齐 hero 标题区域 → 下方内容区域（被截断）"
      },
      "components": {
        "button": "白底黑字、直角、中等尺寸的按钮，如右上角的 Sign up",
        "card": null,
        "chip": null,
        "input": null,
        "hero": "左对齐的大号标题，下方有副标题和按钮，占据大部分视口"
      },
      "motion": {
        "patterns": [
          "导航栏可能的 backdrop-blur 效果",
          "按钮和导航项的悬停状态"
        ]
      },
      "interaction": {
        "hover": "按钮和导航项可能有背景色或透明度的微妙变化",
        "click": null,
        "transition": null,
        "keyboard": null
      },
      "voice": {
        "tone": "直接、专业、功能导向",
        "headlineStyle": "陈述性短语，全小写",
        "ctaStyle": "动词开头，简短直接（如 Log in， Sign up）",
        "avoid": [
          "不使用情感化表达",
          "不使用夸张的修饰词",
          "不使用感叹号"
        ]
      },
      "donts": [
        "不用亮色背景 —— 截图里背景是纯黑 #000000",
        "不做下拉菜单 —— 导航项都是平铺的链接，没有下拉箭头或二级菜单",
        "标题不做居中对齐 —— hero 标题是严格的左对齐",
        "不用卡片阴影 —— 截图里没有看到带阴影的卡片元素",
        "不在文案中放大头像或个人照片 —— 截图里没有用户头像",
        "不用品牌色按钮 —— 唯一的 Sign up 按钮是白底黑字",
        "不用 carousel 或轮播 —— hero 区域是静态的单一标题",
        "不做渐变文字或背景 —— 所有文字都是纯白色，背景是纯黑色"
      ],
      "systemPrompt": "以深色背景 #000000、白色文字 #FFFFFF、几何无衬线字体（geometric-sans）构建极简工具感界面。采用左对齐、直角、无装饰的设计。禁止亮色背景、禁止导航下拉菜单、禁止卡片阴影、禁止品牌色按钮、禁止首屏使用动画或大图。保持信息密度高、留白慷慨、视觉层级清晰。"
    }
  },
  "pack": {
    "available": true,
    "zip_url": "/packs/linear-design-pack.zip",
    "zip_size": 10884041,
    "folder_url": "/packs/linear/",
    "file_count": 22
  }
}
